{
  "schema": "prometeo.study.exam/v2",
  "instance_id": "psicologia-evolutiva-i-p1-2026-v1",
  "course": "Psicología Evolutiva I",
  "exam": {
    "label": "Primer parcial · guía 2026",
    "datetime": null,
    "timezone": "America/Argentina/Buenos_Aires"
  },
  "sources": [
    {
      "id": "syllabus",
      "title": "Syllabus final y hoja de ruta 2026 (17 páginas)",
      "role": "current_authority",
      "notes": "Programa compartido por el estudiante, con 11 módulos y bibliografía. Define alcance de la materia, no contiene todas las explicaciones."
    },
    {
      "id": "repaso",
      "title": "Fotografías de repaso de clase y «TEMAS PARCIAL»",
      "role": "evaluation_evidence",
      "notes": "Material aportado por el estudiante: menciona historia, modelos, Brazelton, Bowlby, Spitz, Winnicott, Freud, juego y dibujo; no se presume frontera oficial definitiva."
    },
    {
      "id": "compañera",
      "title": "Relato de compañera que ya rindió",
      "role": "supporting",
      "notes": "A través del estudiante: énfasis especial en Piaget; estudiar Winnicott, Spitz, Bowlby (apego) y Brazelton. Es una pista anecdótica, no un examen oficial."
    },
    {
      "id": "guia",
      "title": "Desarrollo y ejemplos pedagógicos elaborados",
      "role": "supporting",
      "notes": "Explicaciones complementarias para comprender conceptos de los autores. No reemplazan la bibliografía obligatoria y deben distinguirse del contenido literal del syllabus."
    }
  ],
  "exam_profile": {
    "scope": [
      "Piaget en profundidad",
      "Winnicott",
      "Spitz",
      "Bowlby, Ainsworth y Harlow",
      "Brazelton",
      "Freud",
      "Historia de la infancia",
      "Modelos teóricos",
      "Dibujo, juego, psicomotricidad y adolescencia"
    ],
    "formats": [
      "Formato exacto del parcial no confirmado",
      "La compañera destaca Piaget; el resto es una guía de estudio"
    ],
    "operations": [
      "recall",
      "define",
      "explain",
      "compare",
      "develop",
      "apply",
      "integrate"
    ],
    "evidence_notes": [
      "Piaget tiene prioridad por relato de compañera.",
      "Se cubren también temas de la clase de repaso y los módulos del syllabus.",
      "No se afirma una hora exacta de evaluación."
    ]
  },
  "themes": [
    {
      "id": "papel",
      "background": "#F5DABF",
      "ink": "#6C151E"
    },
    {
      "id": "noche",
      "background": "#17191D",
      "ink": "#F5EAE0"
    },
    {
      "id": "salvia",
      "background": "#E4E9DD",
      "ink": "#204039"
    }
  ],
  "capabilities": {
    "countdown": false,
    "mnemonic_whiteboard": true,
    "audio_dialogue": true
  },
  "transversal_maps": [
    {
      "id": "autores",
      "title": "Un mismo bebé, cinco preguntas",
      "relation": "Cada enfoque intenta explicar un aspecto diferente del desarrollo.",
      "groups": [
        {
          "id": "grupo-0",
          "title": "Piaget",
          "summary": "Cómo construye conocimiento y cambia su razonamiento.",
          "atoms": []
        },
        {
          "id": "grupo-1",
          "title": "Winnicott",
          "summary": "Cómo el cuidado y el ambiente facilitan integración emocional.",
          "atoms": []
        },
        {
          "id": "grupo-2",
          "title": "Spitz",
          "summary": "Cómo aparecen organizadores del psiquismo.",
          "atoms": []
        },
        {
          "id": "grupo-3",
          "title": "Bowlby",
          "summary": "Cómo busca seguridad y construye vínculos de apego.",
          "atoms": []
        },
        {
          "id": "grupo-4",
          "title": "Brazelton",
          "summary": "Con qué repertorio sensorial y conductual nace.",
          "atoms": []
        }
      ]
    }
  ],
  "modules": [
    {
      "id": "piaget-fundamentos",
      "title": "01 · Piaget: cómo se construye el conocimiento",
      "summary": "PRIORIDAD MÁXIMA. Conceptos necesarios para entender todo Piaget.",
      "topics": [
        {
          "id": "ev-001",
          "title": "Epistemología genética y sujeto activo",
          "anchor": "Un bebé prueba una nueva forma de alcanzar un objeto.",
          "summary": "Piaget estudia cómo se origina y transforma el conocimiento, no simplemente cuánto sabe el niño.",
          "explanation": "El niño conoce actuando sobre los objetos y coordinando sus acciones. Las estructuras cognitivas se construyen y reorganizan; no son copias de una realidad recibida pasivamente. Su pregunta central es cómo pasamos de formas simples de inteligencia práctica a operaciones lógicas. Para responder un parcial conviene explicar procesos, no recitar edades.",
          "relations": "Ejemplo para reconocer: Un bebé prueba una nueva forma de alcanzar un objeto.",
          "do_not_confuse": "Prestá atención a qué proceso explica este concepto, no solamente a la edad del niño.",
          "exam_use": "¿Qué estudia la epistemología genética?",
          "source_refs": [
            "syllabus",
            "repaso",
            "compañera",
            "guia"
          ],
          "recall_atoms": [
            {
              "id": "ev-001-1",
              "cue": "¿Qué estudia la epistemología genética?",
              "answer": "La génesis y reorganización de las estructuras del conocimiento.",
              "source_refs": [
                "syllabus",
                "repaso",
                "compañera",
                "guia"
              ]
            }
          ],
          "mastery_dimensions": [
            "recall",
            "explanation",
            "application"
          ]
        },
        {
          "id": "ev-002",
          "title": "Esquema, asimilación y acomodación",
          "anchor": "Confunde gato con perro y después aprende la diferencia.",
          "summary": "Un esquema organiza la acción; la asimilación interpreta lo nuevo con esquemas existentes y la acomodación los modifica.",
          "explanation": "Ejemplo: un chico llama «perro» a un gato porque lo asimila a una categoría que ya conoce. Cuando aprende a diferenciarlos, acomoda su esquema. Ambos procesos son complementarios y no corresponden a dos edades fijas. La asimilación no garantiza que una respuesta sea correcta, y la acomodación no es copiar pasivamente un objeto.",
          "relations": "Ejemplo para reconocer: Confunde gato con perro y después aprende la diferencia.",
          "do_not_confuse": "Prestá atención a qué proceso explica este concepto, no solamente a la edad del niño.",
          "exam_use": "¿Cómo distinguir asimilación y acomodación?",
          "source_refs": [
            "syllabus",
            "repaso",
            "compañera",
            "guia"
          ],
          "recall_atoms": [
            {
              "id": "ev-002-1",
              "cue": "¿Cómo distinguir asimilación y acomodación?",
              "answer": "Asimilación integra una experiencia a un esquema; acomodación modifica ese esquema.",
              "source_refs": [
                "syllabus",
                "repaso",
                "compañera",
                "guia"
              ]
            }
          ],
          "mastery_dimensions": [
            "recall",
            "explanation",
            "application"
          ]
        },
        {
          "id": "ev-003",
          "title": "Equilibración y conflicto cognitivo",
          "anchor": "Una estrategia deja de funcionar y el chico busca otra.",
          "summary": "La equilibración regula cómo el sujeto organiza las tensiones entre asimilación y acomodación.",
          "explanation": "Cuando un esquema no explica lo que sucede aparece un desequilibrio. La exploración y la reorganización pueden conducir a un nuevo equilibrio. Este mecanismo ayuda a explicar cambios cognitivos, aunque un solo error no produce mágicamente un nuevo período del desarrollo. Maduración, experiencia y contexto también intervienen.",
          "relations": "Ejemplo para reconocer: Una estrategia deja de funcionar y el chico busca otra.",
          "do_not_confuse": "Prestá atención a qué proceso explica este concepto, no solamente a la edad del niño.",
          "exam_use": "¿Qué es la equilibración?",
          "source_refs": [
            "syllabus",
            "repaso",
            "compañera",
            "guia"
          ],
          "recall_atoms": [
            {
              "id": "ev-003-1",
              "cue": "¿Qué es la equilibración?",
              "answer": "Autorregulación del desarrollo a través de asimilación y acomodación.",
              "source_refs": [
                "syllabus",
                "repaso",
                "compañera",
                "guia"
              ]
            }
          ],
          "mastery_dimensions": [
            "recall",
            "explanation",
            "application"
          ]
        },
        {
          "id": "ev-004",
          "title": "Cuatro períodos del desarrollo",
          "anchor": "Comparar cómo razonan un bebé, un niño preescolar y uno escolar.",
          "summary": "Sensoriomotor (0–2), preoperatorio (2–7), operaciones concretas (7–11/12) y formales (desde 11/12).",
          "explanation": "En el primero domina la acción práctica; en el segundo aparece la representación, pero no se coordinan aún operaciones reversibles; el tercero permite lógica sobre situaciones concretas; el cuarto posibilita pensamiento hipotético-deductivo. Son períodos teóricos y edades aproximadas, no reglas diagnósticas rígidas. Debés saber para cada uno su conquista principal, limitación y ejemplo.",
          "relations": "Ejemplo para reconocer: Comparar cómo razonan un bebé, un niño preescolar y uno escolar.",
          "do_not_confuse": "Prestá atención a qué proceso explica este concepto, no solamente a la edad del niño.",
          "exam_use": "¿Cuáles son los cuatro períodos en orden?",
          "source_refs": [
            "syllabus",
            "repaso",